{
  "feature": "forge-bootstrap",
  "pipelineStatus": "active",
  "createdAt": "2026-06-18T23:23:16Z",
  "updatedAt": "2026-06-18T23:45:00Z",
  "currentStage": "forge-3-specs",
  "notes": "PRD OQ-01..OQ-05 all resolved in tech-spec. Carry-forward open technical questions for forge-3-specs: OQ-T1 — forge-bootstrap WRITES the monorepo workspaces[] representation, but downstream consumption (forge-2-tech/forge-4-backlog resolving a member's stack) is a deferred follow-up beyond this feature's scope; OQ-T2 — confirm TS test runner (node --test vs lightweight) + minimal dev-deps that keep the TS baseline green across npm/pnpm/yarn; OQ-T3 — confirm .gitignore entry + removal ordering so the .forge-bootstrap.json sentinel can never be committed even on a crash. Architecture: hybrid Python helper (scripts/forge-bootstrap.py, subcommands check/scaffold/verify/commit/status) + SKILL.md orchestration; templates under skills/forge-bootstrap/references/templates/<stack>/; additive workspaces[] schema extension; transient root sentinel for resume; remember to regenerate installer/adapters via build-adapters.py.",
  "stages": {
    "forge-1-prd": {
      "status": "complete",
      "version": 1,
      "artifacts": [
        "PRD.md",
        ".reference/CHARTER.md"
      ],
      "startedAt": "2026-06-18T23:23:16Z",
      "completedAt": "2026-06-18T23:23:16Z",
      "commitHash": "b1ff897ed6a1c9a1cae12a2dce3a2e70f33e595f",
      "basedOnVersions": {}
    },
    "forge-verify-prd": {
      "status": "findings-applied",
      "findingsFile": ".verification/VERIFY-prd-2026-06-18.md",
      "findingsCount": 3,
      "verifiedAt": "2026-06-18T23:30:00Z",
      "fixedAt": "2026-06-18T23:33:00Z"
    },
    "forge-2-tech": {
      "status": "complete",
      "version": 1,
      "artifacts": [
        "tech-spec.md"
      ],
      "startedAt": "2026-06-18T23:45:00Z",
      "completedAt": "2026-06-18T23:45:00Z",
      "commitHash": "310e44745ee6b16d2cda8fb5ee5d70a6e46ee5c8",
      "basedOnVersions": {
        "forge-1-prd": 1
      }
    },
    "forge-verify-tech": {
      "status": "findings-applied",
      "findingsFile": ".verification/VERIFY-tech-2026-06-18.md",
      "findingsCount": 6,
      "verifiedAt": "2026-06-18T23:50:00Z",
      "fixedAt": "2026-06-18T23:55:00Z",
      "commitHash": "80e327f"
    }
  }
}
